{
  "schema_version": 1,
  "source_id": "NT2Lex-CGN-v01",
  "url": "https://cental.uclouvain.be/cefrlex/static/resources/nl/NT2Lex-CGN-v01.tsv",
  "retrieved_at": "2026-10-03T00:17:35.523069+00:00",
  "bytes": 3395377,
  "sha256": "0acae87e65a6ceb4237dcf23c5576488338570f3431ac52e159b6fce9e1a0515",
  "format": "UTF-8 TSV",
  "version": "v01",
  "lineage": ["NT2Lex", "CGN"]
}
